{
  "$schema": "http://json-schema.org/draft-07/schema#",
  "$id": "https://raw.githubusercontent.com/api-evangelist/la-poste/main/json-schema/checkgeneratelabelrequest.json",
  "title": "CheckGenerateLabelRequest",
  "required": [
    "letter"
  ],
  "type": "object",
  "properties": {
    "contractNumber": {
      "type": "string",
      "description": "<i>AN</i> <br/>  <lang><en>Deprecated. Use apikey instead as explained in \"Acess to the Web Service SLS/API Authentication\".</en><fr>Obsol\u00e8te. Utiliser l'apikey \u00e0 la place comme expliqu\u00e9 dans \"Acc\u00e8s au Web Service SLS/Authentification API\".</fr></lang>"
    },
    "password": {
      "type": "string",
      "description": "<i>AN</i> <br/>  <lang><en>Deprecated. Use apikey instead as explained in \"Acess to the Web Service SLS/API Authentication\".</en><fr>Obsol\u00e8te. Utiliser l'apikey \u00e0 la place comme expliqu\u00e9 dans \"Acc\u00e8s au Web Service SLS/Authentification API\".</fr></lang>"
    },
    "letter": {
      "$ref": "#/components/schemas/Letter"
    },
    "outputFormat": {
      "$ref": "#/components/schemas/OutputFormat"
    },
    "fields": {
      "$ref": "#/components/schemas/Fields"
    },
    "customizationFields": {
      "$ref": "#/components/schemas/CustomizationFields"
    }
  }
}